{
  "name": "workspace_member",
  "description": "A user who is a member of a given workspace",
  "owner": "client-infrastructure",
  "version": "1.0.0",
  "system_of_record": "workspace-service",
  "lifecycle_state": "active",
  "primary_key": [
    "workspace_id",
    "keycloak_user_id"
  ],
  "attributes": [
    {
      "name": "workspace_id",
      "description": "The unique identifier of a workspace",
      "data_type": "string",
      "data_format": "uuid"
    },
    {
      "name": "keycloak_user_id",
      "description": "The unique identifier of a keycloak user",
      "data_type": "string",
      "data_format": "uuid"
    },
    {
      "name": "role",
      "description": "The role assigned to the user in the workspace",
      "data_type": "string",
      "data_format": {
        "enum": [
          "admin",
          "member"
        ]
      }
    },
    {
      "name": "inserted_at",
      "description": "The timestamp when the user became a member of the workspace",
      "data_type": "string",
      "data_format": "date-time"
    },
    {
      "name": "removed_at",
      "description": "The timestamp when the user was removed as a member of the workspace",
      "data_type": "string",
      "data_format": "date-time"
    }
  ],
  "relationships": [
    {
      "related_entity": "keycloak_user",
      "related_attribute": "keycloak_user_id",
      "relationship_type": "references"
    },
    {
      "related_entity": "workspace",
      "related_attribute": "workspace_id",
      "relationship_type": "references"
    }
  ],
  "entity_type": "associative"
}

